mysql> CREATE TABLE Venda( 
    -> idVenda INT NOT NULL PRIMARY KEY,
    -> idBolo INT NOT NULL,
    -> dataVenda DATE NOT NULL,
    -> quantidadeVenda INT NOT NULL,
    -> CHECK (quantidadeVenda>0);
ERROR 1064 (42000): You have an error in your SQL syntax; check the manual that corresponds to your MySQL server version for the right syntax to use near '' at line 6
mysql> CREATE TABLE Venda(  idVenda INT NOT NULL PRIMARY KEY, idBolo INT NOT NULL, dataVenda DATE NOT NULL, quantidadeVenda INT NOT NULL, CHECK (quantidadeVenda>0));
Query OK, 0 rows affected (0.044 sec)

mysql> BEGIN
    -> ^C
mysql> BEGIN TRANSACTION
    -> ^C
mysql> BEGIN TRANSACTION;
ERROR 1064 (42000): You have an error in your SQL syntax; check the manual that corresponds to your MySQL server version for the right syntax to use near 'TRANSACTION' at line 1
mysql> CREATE TABLE Venda(
    ->     -> idVenda INT NOT NULL PRIMARY KEY,
    ->     -> idBolo INT NOT NULL,
    ->     -> dataVenda DATE NOT NULL,
    ->     -> quantidadeVenda INT NOT NULL,
    ->     -> CHECK (quantidadeVenda>0);
ERROR 1064 (42000): You have an error in your SQL syntax; check the manual that corresponds to your MySQL server version for the right syntax to use near '-> idVenda INT NOT NULL PRIMARY KEY,
    -> idBolo INT NOT NULL,
    -> dataVend' at line 2
mysql> CREATE TABLE Venda(
    ->     ->     -> idVenda INT NOT NULL PRIMARY KEY,
    ->     ->     -> idBolo INT NOT NULL,
    ->     ->     -> dataVenda DATE NOT NULL,
    ->     ->     -> quantidadeVenda INT NOT NULL,
    ->     ->     -> CHECK (quantidadeVenda>0);
ERROR 1064 (42000): You have an error in your SQL syntax; check the manual that corresponds to your MySQL server version for the right syntax to use near '->     -> idVenda INT NOT NULL PRIMARY KEY,
    ->     -> idBolo INT NOT NULL,
 ' at line 2
mysql> DESC Venda
    -> 
    -> ;
+-----------------+------+------+-----+---------+-------+
| Field           | Type | Null | Key | Default | Extra |
+-----------------+------+------+-----+---------+-------+
| idVenda         | int  | NO   | PRI | NULL    |       |
| idBolo          | int  | NO   |     | NULL    |       |
| dataVenda       | date | NO   |     | NULL    |       |
| quantidadeVenda | int  | NO   |     | NULL    |       |
+-----------------+------+------+-----+---------+-------+
4 rows in set (0.004 sec)

mysql> ALTER TABLE Venda ADD CONSTRAINT idBolo FOREIGN KEY idBolo REFERENCESS Bolo(id);
ERROR 1064 (42000): You have an error in your SQL syntax; check the manual that corresponds to your MySQL server version for the right syntax to use near 'REFERENCESS Bolo(id)' at line 1
mysql> ALTER TABLE Venda ADD CONSTRAINT idBolo FOREIGN KEY idBolo REFERENCES Bolo(id);
ERROR 1064 (42000): You have an error in your SQL syntax; check the manual that corresponds to your MySQL server version for the right syntax to use near 'REFERENCES Bolo(id)' at line 1
mysql> ALTER TABLE Venda ADD CONSTRAINT idBolo FOREIGN KEY (idBolo) REFERENCES Bolo(id);
Query OK, 0 rows affected (0.137 sec)
Records: 0  Duplicates: 0  Warnings: 0

mysql> DESC Venda;
+-----------------+------+------+-----+---------+-------+
| Field           | Type | Null | Key | Default | Extra |
+-----------------+------+------+-----+---------+-------+
| idVenda         | int  | NO   | PRI | NULL    |       |
| idBolo          | int  | NO   | MUL | NULL    |       |
| dataVenda       | date | NO   |     | NULL    |       |
| quantidadeVenda | int  | NO   |     | NULL    |       |
+-----------------+------+------+-----+---------+-------+
4 rows in set (0.003 sec)

mysql> DROP TABLE Venda;
Query OK, 0 rows affected (0.034 sec)

mysql> SHOW DATABASES
    -> ;
+--------------------+
| Database           |
+--------------------+
| Confeitaria        |
| information_schema |
| mysql              |
| performance_schema |
| sys                |
+--------------------+
5 rows in set (0.001 sec)

mysql> DESC Bolo;
+------------+---------------+------+-----+---------+-------+
| Field      | Type          | Null | Key | Default | Extra |
+------------+---------------+------+-----+---------+-------+
| id         | int           | NO   | PRI | NULL    |       |
| nome       | varchar(20)   | NO   |     | NULL    |       |
| preco      | decimal(10,2) | NO   |     | NULL    |       |
| quantidade | int           | NO   |     | NULL    |       |
| categoria  | varchar(25)   | YES  |     | NULL    |       |
+------------+---------------+------+-----+---------+-------+
5 rows in set (0.004 sec)

mysql> DEWSC Venda;
ERROR 1064 (42000): You have an error in your SQL syntax; check the manual that corresponds to your MySQL server version for the right syntax to use near 'DEWSC Venda' at line 1
mysql> DESC Venda;
ERROR 1146 (42S02): Table 'Confeitaria.Venda' doesn't exist
mysql> CREATE TABLE Venda(
    -> idVenda INT NOT NULL PRIMARY KEY,
    -> idBOLO INT NOT NULL,
    -> dataVenda DATE NOT NULL,
    -> quantidadeVendida INT NOT NULL,
    -> FOREIGN KEY idBolo REFERENCES Bolo(id);
ERROR 1064 (42000): You have an error in your SQL syntax; check the manual that corresponds to your MySQL server version for the right syntax to use near 'REFERENCES Bolo(id)' at line 6
mysql> CREATE TABLE Venda( idVenda INT NOT NULL PRIMARY KEY, idBOLO INT NOT NULL, dataVenda DATE NOT NULL, quantidadeVendida INT NOT NULL, FOREIGN KEY (idBolo) REFERENCES Bolo(id);
ERROR 1064 (42000): You have an error in your SQL syntax; check the manual that corresponds to your MySQL server version for the right syntax to use near '' at line 1
mysql> CREATE TABLE Venda( idVenda INT NOT NULL PRIMARY KEY, idBOLO INT NOT NULL, dataVenda DATE NOT NULL, quantidadeVendida INT NOT NULL, FOREIGN KEY (idBolo) REFERENCES Bolo(id));
Query OK, 0 rows affected (0.041 sec)

mysql> DESC Venda;
+-------------------+------+------+-----+---------+-------+
| Field             | Type | Null | Key | Default | Extra |
+-------------------+------+------+-----+---------+-------+
| idVenda           | int  | NO   | PRI | NULL    |       |
| idBOLO            | int  | NO   | MUL | NULL    |       |
| dataVenda         | date | NO   |     | NULL    |       |
| quantidadeVendida | int  | NO   |     | NULL    |       |
+-------------------+------+------+-----+---------+-------+
4 rows in set (0.004 sec)

mysql> BEGIN TRANSACTION;
ERROR 1064 (42000): You have an error in your SQL syntax; check the manual that corresponds to your MySQL server version for the right syntax to use near 'TRANSACTION' at line 1
mysql> START TRANSACTION;
Query OK, 0 rows affected (0.000 sec)

mysql> UPDATE Bolo SET estoque = estoque-2 WHERE id=1;
ERROR 1054 (42S22): Unknown column 'estoque' in 'field list'
mysql> DESC Bolo;
+------------+---------------+------+-----+---------+-------+
| Field      | Type          | Null | Key | Default | Extra |
+------------+---------------+------+-----+---------+-------+
| id         | int           | NO   | PRI | NULL    |       |
| nome       | varchar(20)   | NO   |     | NULL    |       |
| preco      | decimal(10,2) | NO   |     | NULL    |       |
| quantidade | int           | NO   |     | NULL    |       |
| categoria  | varchar(25)   | YES  |     | NULL    |       |
+------------+---------------+------+-----+---------+-------+
5 rows in set (0.003 sec)

mysql> UPDATE Bolo SET quantidade = quantidade-2 WHERE id=1;
Query OK, 1 row affected (0.001 sec)
Rows matched: 1  Changed: 1  Warnings: 0

mysql> DESC Venda;
+-------------------+------+------+-----+---------+-------+
| Field             | Type | Null | Key | Default | Extra |
+-------------------+------+------+-----+---------+-------+
| idVenda           | int  | NO   | PRI | NULL    |       |
| idBOLO            | int  | NO   | MUL | NULL    |       |
| dataVenda         | date | NO   |     | NULL    |       |
| quantidadeVendida | int  | NO   |     | NULL    |       |
+-------------------+------+------+-----+---------+-------+
4 rows in set (0.003 sec)

mysql> INSERT INTO Venda VALUES (1, 1, NOW(), 2);
Query OK, 1 row affected, 1 warning (0.001 sec)

mysql> DESC Venda;
+-------------------+------+------+-----+---------+-------+
| Field             | Type | Null | Key | Default | Extra |
+-------------------+------+------+-----+---------+-------+
| idVenda           | int  | NO   | PRI | NULL    |       |
| idBOLO            | int  | NO   | MUL | NULL    |       |
| dataVenda         | date | NO   |     | NULL    |       |
| quantidadeVendida | int  | NO   |     | NULL    |       |
+-------------------+------+------+-----+---------+-------+
4 rows in set (0.003 sec)

mysql> SELECT * FROM Venda;
+---------+--------+------------+-------------------+
| idVenda | idBOLO | dataVenda  | quantidadeVendida |
+---------+--------+------------+-------------------+
|       1 |      1 | 2025-05-23 |                 2 |
+---------+--------+------------+-------------------+
1 row in set (0.001 sec)

mysql> SELECT * FROM Bolo;
+----+-------------------+-------+------------+-----------+
| id | nome              | preco | quantidade | categoria |
+----+-------------------+-------+------------+-----------+
|  1 | bolo de chocolate | 12.50 |          6 | classico  |
|  2 | bolo de morango   | 16.48 |          3 | fruta     |
|  3 | bolo de banana    | 15.21 |          5 | fruta     |
|  4 | bolo formigueiro  | 14.65 |         11 | classico  |
|  5 | bolo de pote      |  8.75 |          6 | pote      |
+----+-------------------+-------+------------+-----------+
5 rows in set (0.001 sec)

mysql> COMMIT;
Query OK, 0 rows affected (0.007 sec)

mysql> UPDATE Bolo SET quantidade = quantidade-3 WHERE id=5;
Query OK, 1 row affected (0.009 sec)
Rows matched: 1  Changed: 1  Warnings: 0

mysql> SELECT * FROM Bolo;
+----+-------------------+-------+------------+-----------+
| id | nome              | preco | quantidade | categoria |
+----+-------------------+-------+------------+-----------+
|  1 | bolo de chocolate | 12.50 |          6 | classico  |
|  2 | bolo de morango   | 16.48 |          3 | fruta     |
|  3 | bolo de banana    | 15.21 |          5 | fruta     |
|  4 | bolo formigueiro  | 14.65 |         11 | classico  |
|  5 | bolo de pote      |  8.75 |          3 | pote      |
+----+-------------------+-------+------------+-----------+
5 rows in set (0.001 sec)

mysql> UPDATE Bolo SET quantidade = quantidade+3 WHERE id=5;
Query OK, 1 row affected (0.009 sec)
Rows matched: 1  Changed: 1  Warnings: 0

mysql> SELECT * FROM Bolo;
+----+-------------------+-------+------------+-----------+
| id | nome              | preco | quantidade | categoria |
+----+-------------------+-------+------------+-----------+
|  1 | bolo de chocolate | 12.50 |          6 | classico  |
|  2 | bolo de morango   | 16.48 |          3 | fruta     |
|  3 | bolo de banana    | 15.21 |          5 | fruta     |
|  4 | bolo formigueiro  | 14.65 |         11 | classico  |
|  5 | bolo de pote      |  8.75 |          6 | pote      |
+----+-------------------+-------+------------+-----------+
5 rows in set (0.001 sec)

mysql> SELECT * FROM Venda;
+---------+--------+------------+-------------------+
| idVenda | idBOLO | dataVenda  | quantidadeVendida |
+---------+--------+------------+-------------------+
|       1 |      1 | 2025-05-23 |                 2 |
+---------+--------+------------+-------------------+
1 row in set (0.001 sec)

mysql> START TRANSACTION;
Query OK, 0 rows affected (0.000 sec)

mysql> UPDATE Bolo SET quantidade = quantidade-3 WHERE id=5;
Query OK, 1 row affected (0.001 sec)
Rows matched: 1  Changed: 1  Warnings: 0

mysql> SELECT * FROM Bolo;
+----+-------------------+-------+------------+-----------+
| id | nome              | preco | quantidade | categoria |
+----+-------------------+-------+------------+-----------+
|  1 | bolo de chocolate | 12.50 |          6 | classico  |
|  2 | bolo de morango   | 16.48 |          3 | fruta     |
|  3 | bolo de banana    | 15.21 |          5 | fruta     |
|  4 | bolo formigueiro  | 14.65 |         11 | classico  |
|  5 | bolo de pote      |  8.75 |          3 | pote      |
+----+-------------------+-------+------------+-----------+
5 rows in set (0.001 sec)

mysql> INSERT INTO Venda VALUES (2, 5, NOW(), 3);
Query OK, 1 row affected, 1 warning (0.001 sec)

mysql> SELECT * FROM Venda;
+---------+--------+------------+-------------------+
| idVenda | idBOLO | dataVenda  | quantidadeVendida |
+---------+--------+------------+-------------------+
|       1 |      1 | 2025-05-23 |                 2 |
|       2 |      5 | 2025-05-23 |                 3 |
+---------+--------+------------+-------------------+
2 rows in set (0.001 sec)

mysql> ROLLBACK;
Query OK, 0 rows affected (0.002 sec)

mysql> SELECT * FROM Venda;
+---------+--------+------------+-------------------+
| idVenda | idBOLO | dataVenda  | quantidadeVendida |
+---------+--------+------------+-------------------+
|       1 |      1 | 2025-05-23 |                 2 |
+---------+--------+------------+-------------------+
1 row in set (0.001 sec)

mysql> COMMIT;
Query OK, 0 rows affected (0.000 sec)

mysql> SELECT * FROM Bolo;
+----+-------------------+-------+------------+-----------+
| id | nome              | preco | quantidade | categoria |
+----+-------------------+-------+------------+-----------+
|  1 | bolo de chocolate | 12.50 |          6 | classico  |
|  2 | bolo de morango   | 16.48 |          3 | fruta     |
|  3 | bolo de banana    | 15.21 |          5 | fruta     |
|  4 | bolo formigueiro  | 14.65 |         11 | classico  |
|  5 | bolo de pote      |  8.75 |          6 | pote      |
+----+-------------------+-------+------------+-----------+
5 rows in set (0.001 sec)

mysql> UPDATE TABLE Bolo SET quantidade = quantidade-1 WHERE id=3;
ERROR 1064 (42000): You have an error in your SQL syntax; check the manual that corresponds to your MySQL server version for the right syntax to use near 'TABLE Bolo SET quantidade = quantidade-1 WHERE id=3' at line 1
mysql> UPDATE Bolo SET quantidade = quantidade-1 WHERE id=3;
Query OK, 1 row affected (0.007 sec)
Rows matched: 1  Changed: 1  Warnings: 0

mysql> SELECT * FROM Bolo;
+----+-------------------+-------+------------+-----------+
| id | nome              | preco | quantidade | categoria |
+----+-------------------+-------+------------+-----------+
|  1 | bolo de chocolate | 12.50 |          6 | classico  |
|  2 | bolo de morango   | 16.48 |          3 | fruta     |
|  3 | bolo de banana    | 15.21 |          4 | fruta     |
|  4 | bolo formigueiro  | 14.65 |         11 | classico  |
|  5 | bolo de pote      |  8.75 |          6 | pote      |
+----+-------------------+-------+------------+-----------+
5 rows in set (0.001 sec)

mysql> SELECT nome, quandidadeVenda FROM Bolo JOIN ON Bolo.id = Venda.idBolo;
ERROR 1064 (42000): You have an error in your SQL syntax; check the manual that corresponds to your MySQL server version for the right syntax to use near 'ON Bolo.id = Venda.idBolo' at line 1
mysql> SELECT nome, quandidadeVenda FROM Bolo JOIN Venda ON Bolo.id = Venda.idBolo;
ERROR 1054 (42S22): Unknown column 'quandidadeVenda' in 'field list'
mysql> SELECT nome, quandidadeVendida FROM Bolo JOIN Venda ON Bolo.id = Venda.idBolo;
ERROR 1054 (42S22): Unknown column 'quandidadeVendida' in 'field list'
mysql> SELECT nome, quantidadeVendida FROM Bolo JOIN Venda ON Bolo.id = Venda.idBolo;
+-------------------+-------------------+
| nome              | quantidadeVendida |
+-------------------+-------------------+
| bolo de chocolate |                 2 |
+-------------------+-------------------+
1 row in set (0.001 sec)

mysql> SELECT nome, categoria, quantidade FROM Bolo;
+-------------------+-----------+------------+
| nome              | categoria | quantidade |
+-------------------+-----------+------------+
| bolo de chocolate | classico  |          6 |
| bolo de morango   | fruta     |          3 |
| bolo de banana    | fruta     |          4 |
| bolo formigueiro  | classico  |         11 |
| bolo de pote      | pote      |          6 |
+-------------------+-----------+------------+
5 rows in set (0.001 sec)

mysql> SELECT * FROM Bolo WHERE id NOT IN (SELECT idBOLO FROM Venda);
+----+------------------+-------+------------+-----------+
| id | nome             | preco | quantidade | categoria |
+----+------------------+-------+------------+-----------+
|  2 | bolo de morango  | 16.48 |          3 | fruta     |
|  3 | bolo de banana   | 15.21 |          4 | fruta     |
|  4 | bolo formigueiro | 14.65 |         11 | classico  |
|  5 | bolo de pote     |  8.75 |          6 | pote      |
+----+------------------+-------+------------+-----------+
4 rows in set (0.001 sec)

mysql> notee
